{
  "$schema": "http://json-schema.org/draft-07/schema#",
  "$id": "https://burohappoldengineeringsandbox.github.io/CI_Health_Dashboard/schemas/run-record.schema.json",
  "title": "CI Run Record",
  "description": "A single per-workflow health record emitted by ci-emit-health.yml in CI_Toolkit and dispatched to CI_Health_Dashboard via repository_dispatch.",
  "type": "object",
  "required": ["repository", "run_id", "workflow", "status", "trigger", "ref", "sha", "run_url", "timestamp"],
  "additionalProperties": false,
  "properties": {
    "repository": {
      "type": "string",
      "description": "Full org/repo identifier of the source repository.",
      "pattern": "^[A-Za-z0-9_.-]+/[A-Za-z0-9_.-]+$",
      "examples": ["BuroHappoldEngineeringSandbox/BHoM_Adapter"]
    },
    "run_id": {
      "type": "string",
      "description": "GitHub Actions run ID.",
      "pattern": "^[0-9]+$"
    },
    "workflow": {
      "type": "string",
      "description": "Name of the CI workflow that emitted this record (e.g. ci-build).",
      "examples": ["ci-build", "ci-format", "ci-code-compliance", "ci-dataset-compliance", "ci-unit-tests"]
    },
    "status": {
      "type": "string",
      "description": "Result of the CI job.",
      "enum": ["success", "failure", "cancelled", "skipped"]
    },
    "trigger": {
      "type": "string",
      "description": "GitHub Actions event name that triggered the run.",
      "examples": ["pull_request", "push", "workflow_dispatch"]
    },
    "ref": {
      "type": "string",
      "description": "Destination branch (base_ref for PRs, ref_name for push). Always a branch name, never a PR ref.",
      "examples": ["develop", "main"]
    },
    "sha": {
      "type": "string",
      "description": "Full commit SHA that was tested.",
      "pattern": "^[0-9a-f]{40}$"
    },
    "pr_number": {
      "type": "string",
      "description": "Pull request number (empty string for non-PR triggers)."
    },
    "run_url": {
      "type": "string",
      "description": "Full URL to the GitHub Actions run.",
      "format": "uri"
    },
    "timestamp": {
      "type": "string",
      "description": "ISO 8601 UTC timestamp when the emit-health job ran.",
      "format": "date-time"
    }
  }
}
