{"pr_number":"11","ref":"develop","repository":"BuroHappoldEngineeringSandbox/BHoM_Adapter","run_id":"24968541001","run_url":"https://github.com/BuroHappoldEngineeringSandbox/BHoM_Adapter/actions/runs/24968541001","sha":"a9d0a6408bf8c72c58be5df2245aaf53b129f1b5","status":"success","timestamp":"2026-04-26T22:22:55Z","trigger":"pull_request","workflow":"ci-dataset-compliance"}
