{
  "pr_number": "10",
  "ref": "develop",
  "repository": "BuroHappoldEngineeringSandbox/Revit_Toolkit",
  "run_id": "24968251816",
  "run_url": "https://github.com/BuroHappoldEngineeringSandbox/Revit_Toolkit/actions/runs/24968251816",
  "sha": "c0f02e6ea6da06ec7a0aa98706d88f954668e587",
  "status": "success",
  "timestamp": "2026-04-26T22:10:23Z",
  "trigger": "pull_request",
  "workflow": "ci-copyright-compliance"
}
