{"pr_number":"11","ref":"develop","repository":"BuroHappoldEngineeringSandbox/BHoM_Adapter","run_id":"24968963102","run_url":"https://github.com/BuroHappoldEngineeringSandbox/BHoM_Adapter/actions/runs/24968963102","sha":"fb61e47485f2419a192352c52f4ced31f1b91695","status":"success","timestamp":"2026-04-26T22:47:27Z","trigger":"pull_request","workflow":"ci-documentation-compliance"}
