{"pr_number":"10","ref":"develop","repository":"BuroHappoldEngineeringSandbox/Revit_Toolkit","run_id":"24968963410","run_url":"https://github.com/BuroHappoldEngineeringSandbox/Revit_Toolkit/actions/runs/24968963410","sha":"e7eb9d04bc33de6bc10d879dc8989776f3b7f474","status":"success","timestamp":"2026-04-26T22:47:16Z","trigger":"pull_request","workflow":"ci-project-compliance"}
