{"pr_number":"8","ref":"develop","repository":"BuroHappoldEngineeringSandbox/BHoM","run_id":"24968963140","run_url":"https://github.com/BuroHappoldEngineeringSandbox/BHoM/actions/runs/24968963140","sha":"d52d2a66658fcaaba9e88432af78f35ef850b2bd","status":"failure","timestamp":"2026-04-26T22:47:33Z","trigger":"pull_request","workflow":"ci-copyright-compliance"}
