{
  "pr_number": "8",
  "ref": "develop",
  "repository": "BuroHappoldEngineeringSandbox/BHoM",
  "run_id": "24968252437",
  "run_url": "https://github.com/BuroHappoldEngineeringSandbox/BHoM/actions/runs/24968252437",
  "sha": "0e2ca79f0fb1ab72d2ff7f878e79edd42d1846a1",
  "status": "success",
  "timestamp": "2026-04-26T22:08:15Z",
  "trigger": "pull_request",
  "workflow": "ci-format"
}
