{"pr_number":"8","ref":"develop","repository":"BuroHappoldEngineeringSandbox/BHoM","run_id":"24968541396","run_url":"https://github.com/BuroHappoldEngineeringSandbox/BHoM/actions/runs/24968541396","sha":"e69fab72b887b8ab759ff3bce7f56d235b0d5e14","status":"success","timestamp":"2026-04-26T22:25:12Z","trigger":"pull_request","workflow":"ci-project-compliance"}
