{
  "pr_number": "10",
  "ref": "develop",
  "repository": "BuroHappoldEngineeringSandbox/Revit_Toolkit",
  "run_id": "24964486508",
  "run_url": "https://github.com/BuroHappoldEngineeringSandbox/Revit_Toolkit/actions/runs/24964486508",
  "sha": "a66a672820a1680796a900b7f09d3096fb9658d3",
  "status": "failure",
  "timestamp": "2026-04-26T19:00:33Z",
  "trigger": "pull_request",
  "workflow": "ci-build"
}
