{"pr_number":"11","ref":"develop","repository":"BuroHappoldEngineeringSandbox/BHoM_Adapter","run_id":"24968963094","run_url":"https://github.com/BuroHappoldEngineeringSandbox/BHoM_Adapter/actions/runs/24968963094","sha":"fb61e47485f2419a192352c52f4ced31f1b91695","status":"failure","timestamp":"2026-04-26T22:47:07Z","trigger":"pull_request","workflow":"ci-unit-tests"}
