{"pr_number":"10","ref":"develop","repository":"BuroHappoldEngineeringSandbox/Revit_Toolkit","run_id":"24968540931","run_url":"https://github.com/BuroHappoldEngineeringSandbox/Revit_Toolkit/actions/runs/24968540931","sha":"6d4175395146875be2f0bd47912a1efd6c171645","status":"success","timestamp":"2026-04-26T22:22:50Z","trigger":"pull_request","workflow":"ci-unit-tests"}
